Thu 15 Jan 2026 15:59:03 INFO ██Server: 	mgt
Thu 15 Jan 2026 15:59:03 INFO ██Dir: 	/mnt/data/tuwenhui/Multi-recommodation/PMMRec-main/src

Thu 15 Jan 2026 15:59:03 INFO 
gpu_id=0
use_gpu=True
seed=[999]
data_path=../data/
inter_splitting_label=x_label
filter_out_cod_start_users=True
is_multimodal_model=True
checkpoint_dir=saved
save_recommended_topk=True
recommend_topk=recommend_topk/
embedding_size=64
weight_decay=0.0
req_training=True
epochs=1000
stopping_step=20
train_batch_size=2048
learner=adam
learning_rate=[0.0001]
learning_rate_scheduler=[1.0, 50]
eval_step=1
training_neg_sample_num=1
use_neg_sampling=True
use_full_sampling=False
NEG_PREFIX=neg__
USER_ID_FIELD=userID
ITEM_ID_FIELD=itemID
TIME_FIELD=timestamp
field_separator=	
metrics=['Recall', 'NDCG', 'Precision', 'MAP']
topk=[5, 10, 20, 50]
valid_metric=Recall@10
eval_batch_size=4096
use_raw_features=False
max_txt_len=32
max_img_size=256
vocab_size=30522
type_vocab_size=2
hidden_size=4
pad_token_id=0
max_position_embeddings=512
layer_norm_eps=1e-12
hidden_dropout_prob=0.1
end2end=False
hyper_parameters=['reg_weight', 'learning_rate', 'dropout', 'mask_weight_f', 'temp', 'seed']
inter_file_name=baby.inter
vision_feature_file=image_feat.npy
text_feature_file=text_feat.npy
user_graph_dict_file=user_graph_dict.npy
feat_embed_dim=64
n_mm_layers=1
n_layers=2
knn_k=10
mm_image_weight=0.1
reg_weight=[0.001]
start_expert_num=4
start_gate_selection=softmax
initializer_weight=[0.1, 0.5, 0.5]
dropout=[0.5]
mask_weight_f=[1.5]
temp=[0.6]
model=PMMRec
dataset=baby
valid_metric_bigger=True
device=cuda


Thu 15 Jan 2026 15:59:03 INFO baby
The number of users: 19445
Average actions of users: 8.269066598097197
The number of items: 7050
Average actions of items: 22.807375886524824
The number of inters: 160792
The sparsity of the dataset: 99.8827082752043%
Thu 15 Jan 2026 15:59:03 INFO 
====Training====
baby
The number of users: 19445
Average actions of users: 6.096734379017742
The number of items: 7047
Average actions of items: 16.82290336313325
The number of inters: 118551
The sparsity of the dataset: 99.9134846831415%
Thu 15 Jan 2026 15:59:03 INFO 
====Validation====
baby
The number of users: 19445
Average actions of users: 1.0572897917202366
The number of items: 5483
Average actions of items: 3.749589640707642
The number of inters: 20559
The sparsity of the dataset: 99.98071694707788%
Thu 15 Jan 2026 15:59:03 INFO 
====Testing====
baby
The number of users: 19445
Average actions of users: 1.1150424273592183
The number of items: 5549
Average actions of items: 3.907370697422959
The number of inters: 21682
The sparsity of the dataset: 99.97990552482683%
Thu 15 Jan 2026 15:59:06 INFO 

=================================


Thu 15 Jan 2026 15:59:06 INFO =========1/1: Parameters:['reg_weight', 'learning_rate', 'dropout', 'mask_weight_f', 'temp', 'seed']=(0.001, 0.0001, 0.5, 1.5, 0.6, 999)=======
Thu 15 Jan 2026 15:59:11 INFO PMMRec(
  (mlp): Linear(in_features=128, out_features=128, bias=True)
  (image_embedding): Embedding(7050, 4096)
  (image_trs): Linear(in_features=4096, out_features=64, bias=True)
  (text_embedding): Embedding(7050, 384)
  (text_trs): Linear(in_features=384, out_features=64, bias=True)
  (MLP_user): Linear(in_features=128, out_features=64, bias=True)
  (v_gcn): GCN(
    (MLP): Linear(in_features=4096, out_features=256, bias=True)
    (MLP_1): Linear(in_features=256, out_features=64, bias=True)
    (conv_embed_1): Base_gcn(64, 64)
  )
  (v_gcn_n1): GCN(
    (MLP): Linear(in_features=4096, out_features=256, bias=True)
    (MLP_1): Linear(in_features=256, out_features=64, bias=True)
    (conv_embed_1): Base_gcn(64, 64)
  )
  (v_gcn_n2): GCN(
    (MLP): Linear(in_features=4096, out_features=256, bias=True)
    (MLP_1): Linear(in_features=256, out_features=64, bias=True)
    (conv_embed_1): Base_gcn(64, 64)
  )
  (t_gcn): GCN(
    (MLP): Linear(in_features=384, out_features=256, bias=True)
    (MLP_1): Linear(in_features=256, out_features=64, bias=True)
    (conv_embed_1): Base_gcn(64, 64)
  )
  (t_gcn_n1): GCN(
    (MLP): Linear(in_features=384, out_features=256, bias=True)
    (MLP_1): Linear(in_features=256, out_features=64, bias=True)
    (conv_embed_1): Base_gcn(64, 64)
  )
  (t_gcn_n2): GCN(
    (MLP): Linear(in_features=384, out_features=256, bias=True)
    (MLP_1): Linear(in_features=256, out_features=64, bias=True)
    (conv_embed_1): Base_gcn(64, 64)
  )
  (id_gcn): GCN(
    (MLP): Linear(in_features=64, out_features=256, bias=True)
    (MLP_1): Linear(in_features=256, out_features=64, bias=True)
    (conv_embed_1): Base_gcn(64, 64)
  )
  (start_moe_user): Align_MoE(
    (gate_txt): Linear(in_features=64, out_features=4, bias=True)
    (gate_img): Linear(in_features=64, out_features=4, bias=True)
    (gate_id): Linear(in_features=64, out_features=4, bias=True)
    (expert): ModuleList(
      (0-3): 4 x Linear(in_features=192, out_features=192, bias=True)
    )
  )
  (start_moe_item): Align_MoE(
    (gate_txt): Linear(in_features=64, out_features=4, bias=True)
    (gate_img): Linear(in_features=64, out_features=4, bias=True)
    (gate_id): Linear(in_features=64, out_features=4, bias=True)
    (expert): ModuleList(
      (0-3): 4 x Linear(in_features=192, out_features=192, bias=True)
    )
  )
)
Trainable parameters: 44983132
Thu 15 Jan 2026 16:00:51 INFO epoch 0 training [time: 99.70s, train loss: -28.8769]
Thu 15 Jan 2026 16:00:56 INFO epoch 0 evaluating [time: 2.69s, valid_score: 0.029100]
Thu 15 Jan 2026 16:00:56 INFO valid result: 
recall@5: 0.0195    recall@10: 0.0291    recall@20: 0.0463    recall@50: 0.0909    ndcg@5: 0.0128    ndcg@10: 0.0159    ndcg@20: 0.0202    ndcg@50: 0.0291    precision@5: 0.0041    precision@10: 0.0031    precision@20: 0.0024    precision@50: 0.0019    map@5: 0.0104    map@10: 0.0116    map@20: 0.0128    map@50: 0.0142    
Thu 15 Jan 2026 16:00:56 INFO test result: 
recall@5: 0.0188    recall@10: 0.0305    recall@20: 0.0484    recall@50: 0.0918    ndcg@5: 0.0122    ndcg@10: 0.0160    ndcg@20: 0.0206    ndcg@50: 0.0293    precision@5: 0.0041    precision@10: 0.0033    precision@20: 0.0027    precision@50: 0.0020    map@5: 0.0097    map@10: 0.0112    map@20: 0.0124    map@50: 0.0137    
Thu 15 Jan 2026 16:00:56 INFO ██ PMMRec--Best validation results updated!!!
Thu 15 Jan 2026 16:01:13 INFO Loss is nan at epoch: 1, batch index: 13. Exiting.
Thu 15 Jan 2026 16:01:13 INFO best valid result: recall@5: 0.0195    recall@10: 0.0291    recall@20: 0.0463    recall@50: 0.0909    ndcg@5: 0.0128    ndcg@10: 0.0159    ndcg@20: 0.0202    ndcg@50: 0.0291    precision@5: 0.0041    precision@10: 0.0031    precision@20: 0.0024    precision@50: 0.0019    map@5: 0.0104    map@10: 0.0116    map@20: 0.0128    map@50: 0.0142    
Thu 15 Jan 2026 16:01:13 INFO test result: recall@5: 0.0188    recall@10: 0.0305    recall@20: 0.0484    recall@50: 0.0918    ndcg@5: 0.0122    ndcg@10: 0.0160    ndcg@20: 0.0206    ndcg@50: 0.0293    precision@5: 0.0041    precision@10: 0.0033    precision@20: 0.0027    precision@50: 0.0020    map@5: 0.0097    map@10: 0.0112    map@20: 0.0124    map@50: 0.0137    
Thu 15 Jan 2026 16:01:13 INFO ████Current BEST████:
Parameters: ['reg_weight', 'learning_rate', 'dropout', 'mask_weight_f', 'temp', 'seed']=(0.001, 0.0001, 0.5, 1.5, 0.6, 999),
Valid: recall@5: 0.0195    recall@10: 0.0291    recall@20: 0.0463    recall@50: 0.0909    ndcg@5: 0.0128    ndcg@10: 0.0159    ndcg@20: 0.0202    ndcg@50: 0.0291    precision@5: 0.0041    precision@10: 0.0031    precision@20: 0.0024    precision@50: 0.0019    map@5: 0.0104    map@10: 0.0116    map@20: 0.0128    map@50: 0.0142    ,
Test: recall@5: 0.0188    recall@10: 0.0305    recall@20: 0.0484    recall@50: 0.0918    ndcg@5: 0.0122    ndcg@10: 0.0160    ndcg@20: 0.0206    ndcg@50: 0.0293    precision@5: 0.0041    precision@10: 0.0033    precision@20: 0.0027    precision@50: 0.0020    map@5: 0.0097    map@10: 0.0112    map@20: 0.0124    map@50: 0.0137    



Thu 15 Jan 2026 16:01:13 INFO 
============All Over=====================
Thu 15 Jan 2026 16:01:13 INFO Parameters: ['reg_weight', 'learning_rate', 'dropout', 'mask_weight_f', 'temp', 'seed']=(0.001, 0.0001, 0.5, 1.5, 0.6, 999),
 best valid: recall@5: 0.0195    recall@10: 0.0291    recall@20: 0.0463    recall@50: 0.0909    ndcg@5: 0.0128    ndcg@10: 0.0159    ndcg@20: 0.0202    ndcg@50: 0.0291    precision@5: 0.0041    precision@10: 0.0031    precision@20: 0.0024    precision@50: 0.0019    map@5: 0.0104    map@10: 0.0116    map@20: 0.0128    map@50: 0.0142    ,
 best test: recall@5: 0.0188    recall@10: 0.0305    recall@20: 0.0484    recall@50: 0.0918    ndcg@5: 0.0122    ndcg@10: 0.0160    ndcg@20: 0.0206    ndcg@50: 0.0293    precision@5: 0.0041    precision@10: 0.0033    precision@20: 0.0027    precision@50: 0.0020    map@5: 0.0097    map@10: 0.0112    map@20: 0.0124    map@50: 0.0137    
Thu 15 Jan 2026 16:01:13 INFO 

█████████████ BEST ████████████████
Thu 15 Jan 2026 16:01:13 INFO 	Parameters: ['reg_weight', 'learning_rate', 'dropout', 'mask_weight_f', 'temp', 'seed']=(0.001, 0.0001, 0.5, 1.5, 0.6, 999),
Valid: recall@5: 0.0195    recall@10: 0.0291    recall@20: 0.0463    recall@50: 0.0909    ndcg@5: 0.0128    ndcg@10: 0.0159    ndcg@20: 0.0202    ndcg@50: 0.0291    precision@5: 0.0041    precision@10: 0.0031    precision@20: 0.0024    precision@50: 0.0019    map@5: 0.0104    map@10: 0.0116    map@20: 0.0128    map@50: 0.0142    ,
Test: recall@5: 0.0188    recall@10: 0.0305    recall@20: 0.0484    recall@50: 0.0918    ndcg@5: 0.0122    ndcg@10: 0.0160    ndcg@20: 0.0206    ndcg@50: 0.0293    precision@5: 0.0041    precision@10: 0.0033    precision@20: 0.0027    precision@50: 0.0020    map@5: 0.0097    map@10: 0.0112    map@20: 0.0124    map@50: 0.0137    


